<?xml version="1.0" encoding="UTF-8"?>
<!-- Nombre: Elena Qin Real Zhang
Curso: 1DAM
Fecha: 03/04/2025
Ejercicio: Ejercicio 3
Cambio: Se agregó la documentación necesaria
-->
<!DOCTYPE agenda SYSTEM "ejercicio3.dtd"> <!-- Enlazando con la DTD externa -->
<agenda>
    <nombre>Antonio</nombre>
    <apellido>Sánchez</apellido>
    <apellido>Pérez</apellido>
    <telefono>666555444</telefono>
    <fecha_nacimiento>
        <anio>2000</anio>
        <mes>01</mes>
        <dia>20</dia>
    </fecha_nacimiento>
    <lugar_nacimiento>
        <pais>España</pais>
        <ciudad>Madrid</ciudad>
        <localidad>Getafe</localidad>
    </lugar_nacimiento>
</agenda>